{"schema":"dinhot.benchmark/v1","engine_version":"0.00.000","protocol":{"grids":[64],"seeds":3,"budgets":{"iterations":[30],"time_s":[0.5]},"device":{"en":"Ideal SLM","es":"SLM ideal"}},"geometries":[{"id":"G1","name":{"en":"Three traps in a line","es":"Tres trampas en línea"},"n_traps":3,"dims":2},{"id":"G2","name":{"en":"Three traps in depth","es":"Tres trampas en profundidad"},"n_traps":3,"dims":3}],"rows":[{"method":"M04","geometry":"G1","device":"ideal","budget_kind":"iterations","budget":30,"params":"default","n_seeds":3,"efficiency":{"median":0.84,"q1":0.82,"q3":0.86},"uniformity":{"median":0.93,"q1":0.91,"q3":0.95},"rel_std_pct":{"median":4.1,"q1":3.6,"q3":4.6},"time_s":{"median":0.01,"q1":0.009,"q3":0.012},"iterations":{"median":30,"q1":30,"q3":30}},{"method":"M06","geometry":"G1","device":"ideal","budget_kind":"iterations","budget":30,"params":"default","n_seeds":3,"efficiency":{"median":0.78,"q1":0.76,"q3":0.8},"uniformity":{"median":0.97,"q1":0.95,"q3":0.99},"rel_std_pct":{"median":2.0,"q1":1.5,"q3":2.5},"time_s":{"median":0.01,"q1":0.009,"q3":0.012},"iterations":{"median":30,"q1":30,"q3":30}}],"pareto":[{"geometry":"G1","method":"B5","points":[{"lambda":0.0,"efficiency":0.84,"uniformity":0.93},{"lambda":1.0,"efficiency":0.78,"uniformity":0.97}]}],"skipped":[{"method":"M06","geometry":"G2","reason":{"en":"Not run: the method has no 3D form.","es":"No ejecutado: el método no tiene forma 3D."}}]}